Entry,Entry name,Status,Protein names,Gene names,Organism,Length,
O00141,SGK1_HUMAN,reviewed,Serine/threonine-protein kinase Sgk1 (EC 2.7.11.1) (Serum/glucocorticoid-regulated kinase 1),SGK1 SGK,Homo sapiens (Human),431,mitochondria
Q13586,STIM1_HUMAN,reviewed,Stromal interaction molecule 1,STIM1 GOK,Homo sapiens (Human),685,mitochondria
Q14643,ITPR1_HUMAN,reviewed,"Inositol 1,4,5-trisphosphate receptor type 1 (IP3 receptor isoform 1) (IP3R 1) (InsP3R1) (Type 1 inositol 1,4,5-trisphosphate receptor) (Type 1 InsP3 receptor)",ITPR1 INSP3R1,Homo sapiens (Human),2758,mitochondria
Q14573,ITPR3_HUMAN,reviewed,"Inositol 1,4,5-trisphosphate receptor type 3 (IP3 receptor isoform 3) (IP3R 3) (InsP3R3) (Type 3 inositol 1,4,5-trisphosphate receptor) (Type 3 InsP3 receptor)",ITPR3,Homo sapiens (Human),2671,mitochondria
Q9BPX6,MICU1_HUMAN,reviewed,"Calcium uptake protein 1, mitochondrial (Atopy-related autoantigen CALC) (ara CALC) (Calcium-binding atopy-related autoantigen 1) (allergen Hom s 4)",MICU1 CALC CBARA1,Homo sapiens (Human),476,mitochondria
Q02790,FKBP4_HUMAN,reviewed,"Peptidyl-prolyl cis-trans isomerase FKBP4 (PPIase FKBP4) (EC 5.2.1.8) (51 kDa FK506-binding protein) (FKBP51) (52 kDa FK506-binding protein) (52 kDa FKBP) (FKBP-52) (59 kDa immunophilin) (p59) (FK506-binding protein 4) (FKBP-4) (FKBP59) (HSP-binding immunophilin) (HBI) (Immunophilin FKBP52) (Rotamase) [Cleaved into: Peptidyl-prolyl cis-trans isomerase FKBP4, N-terminally processed]",FKBP4 FKBP52,Homo sapiens (Human),459,mitochondria
P14780,MMP9_HUMAN,reviewed,Matrix metalloproteinase-9 (MMP-9) (EC 3.4.24.35) (92 kDa gelatinase) (92 kDa type IV collagenase) (Gelatinase B) (GELB) [Cleaved into: 67 kDa matrix metalloproteinase-9; 82 kDa matrix metalloproteinase-9],MMP9 CLG4B,Homo sapiens (Human),707,mitochondria
P49281,NRAM2_HUMAN,reviewed,Natural resistance-associated macrophage protein 2 (NRAMP 2) (Divalent cation transporter 1) (Divalent metal transporter 1) (DMT-1) (Solute carrier family 11 member 2),SLC11A2 DCT1 DMT1 NRAMP2 OK/SW-cl.20,Homo sapiens (Human),568,mitochondria
Q5S007,LRRK2_HUMAN,reviewed,Leucine-rich repeat serine/threonine-protein kinase 2 (EC 2.7.11.1) (EC 3.6.5.-) (Dardarin),LRRK2 PARK8,Homo sapiens (Human),2527,mitochondria
S4R468,S4R468_HUMAN,unreviewed,Calcium uniporter protein (Fragment),MCU,Homo sapiens (Human),167,mitochondria
B4DWD0,B4DWD0_HUMAN,unreviewed,Calcium uniporter protein,,Homo sapiens (Human),109,mitochondria